id,nome,categoria,descricao,valor
1, training, biografia, Book else nothing say family set. Little small coach ever own develop doctor.\nHeart his summer phone lay story. Budget although society occur enough push. Remember still choice clear., 422.00
2, organization, terror, Live interest quickly imagine. Race attorney focus site much. Movement song prove collection personal nothing next., 456.00
3, sign, romance, Big represent commercial perhaps yeah radio data. Care marriage back how. Education under black local.\nPicture run benefit star station sell we. Shoulder list mother open., 162.00
4, rate, ficcao, Plan kid ready become. Writer reflect well sometimes right TV.\nAllow at exactly level decide. Image goal manage consider., 427.00
5, wait, romance, Movie as short happy recognize. Treatment defense Congress save eye method.\nThought age under close then. Site me treat feeling front., 465.00
6, group, terror, Everything detail less detail. Business institution recently produce. Watch fire idea.\nAhead and project fall drive appear. Theory quality there company. Before per line sport case evening., 298.00
7, remember, ficcao, Name subject story claim forget. Possible section surface director. Body expect treatment and.\nVarious general wrong sit. Near reflect cause modern travel someone girl., 730.00
8, above, romance, Yet game require three rule. Respond how herself cup high among end affect. Indicate form thank fight special response ask., 558.00
9, nor, terror, Four hard professor change stop heart. Two herself allow budget speech.\nUs thus expert court once. List security simple question., 999.00
10, might, terror, News security trade film give however. Memory manage teacher choice school include impact. Process find rule little happy.\nState rock reveal hot., 563.00
11, buy, ficcao, Only big base possible staff. Far star attack baby challenge want herself bill. Study program seven behavior., 981.00
12, letter, terror, Leader while wonder.\nMajority modern measure prevent. Structure pattern gun card in. Husband energy challenge surface or personal.\nCause window music. Professional drive government final., 620.00
13, lead, biografia, Standard condition religious better when.\nHuge article represent father others new. Want discuss across then action. Candidate whom value nearly conference claim of., 526.00
14, north, suspense, Good him local apply since. Cause including travel positive hour. Lot describe baby task sea.\nForm store smile something listen hospital. Difficult image at music sign debate either best., 634.00
15, simply, ficcao, Under alone recently small hour.\nBit defense foreign project bill upon consumer. Stuff physical pretty it tend region teach., 148.00
16, television, romance, Loss voice technology whom. Two live prove owner doctor what authority public.\nUp born majority minute while contain where result. Imagine opportunity fire. Together we area forget measure start., 641.00
17, wind, suspense, Without idea meeting improve. Doctor capital listen success.\nLeave usually and source. Man determine certainly course production. Message information sing on., 107.00
18, manager, ficcao, Paper bill nearly final short glass. Finally assume usually itself region gas they second., 830.00
19, thousand, ficcao, Go far allow week sit young past get. Like generation under threat turn it field have. Case partner cost control available artist both., 740.00
20, receive, terror, Move kid condition grow even trial candidate. Among really study trip he region himself. Imagine agree yes knowledge., 111.00
21, room, terror, Oil speak try study break. Way respond meeting beautiful outside shoulder chance finish.\nBook goal star home past put become. Push top standard away number., 998.00
22, why, ficcao, Check hot stay turn impact remain. Do investment together phone glass still. Recently plant western city difference., 995.00
23, more, suspense, Go rate common down market movement.\nLocal peace science born middle someone southern., 373.00
24, value, ficcao, Particular local large commercial.\nSocial life feeling project right practice wonder. Lay even herself indicate my. Spring window life adult southern., 745.00
25, work, ficcao, Class sport suddenly staff consider perform. Check quality dog task simple morning.\nLand remember child government answer. Rate outside forget whose lead. From drive up too right individual., 140.00
26, age, biografia, Hold color improve score class allow last. Never group off class., 873.00
27, century, romance, Raise piece goal official pay.\nRemember system want military final hold here. Rate everything thousand sit. Employee return city miss. Region yeah what executive wonder medical., 591.00
28, deal, biografia, True evening however raise. Something able couple nation central. Building project during step picture.\nEnough five firm change person., 936.00
29, little, romance, Feeling five make explain much degree type miss. Late not treat city suddenly. Doctor under happen beyond wrong.\nFly ten require range fund art. North piece him president., 115.00
30, executive, romance, Bring eight drive if send. Treat conference morning police.\nGame thing identify program small different. Along issue determine police once.\nEverybody happen but too. Thing deal goal., 757.00
31, cover, romance, Open should box man wrong support. Seem respond important difference.\nTask interesting deep follow pretty morning. Control rule she among. Feeling next or hospital late., 459.00
32, simple, terror, Trial Mr point wide increase morning. Mission old although network. Prepare fly lose development watch., 225.00
33, to, biografia, Sense beautiful personal doctor woman generation power. Police nothing building design study structure.\nWriter out test above network challenge., 401.00
34, key, suspense, Guy ok recently either world usually relationship read. Pass much bill doctor read., 881.00
35, area, biografia, Product factor million. Leg clear much fast.\nAgainst behind break. Relationship member night body new study whole. Quality least three interesting newspaper.\nPopular sit seem once ok reality civil., 564.00
36, me, biografia, Few floor customer market. Argue parent weight final there. Education decade pressure some. Success although dinner nice., 422.00
37, avoid, romance, Everything store north commercial economic drop else. Enjoy individual long night standard. Conference cause particular feel relate week., 407.00
38, new, biografia, Expect administration seven sign by force. Several grow huge clear no sister., 878.00
39, hope, ficcao, East offer same place hundred six recognize. Various seek into student play possible three. Focus out travel green last forget trial him.\nComputer see find part. Remember citizen know success., 652.00
40, home, suspense, Woman low school laugh answer amount goal student.\nShe may really mean begin rate consider.\nTrouble industry less according unit want. Economy police color century research arm., 520.00
41, least, terror, Face report five likely. Language involve under goal suffer safe inside.\nLeft maybe effort join information push Congress. Culture red positive not risk., 619.00
42, spend, terror, Data director take anyone. Camera day offer beyond impact professor. Home quickly he religious similar true eat., 587.00
43, institution, suspense, Avoid something on prove just.\nRelate drive way crime. Morning believe officer audience group night section.\nMaintain reality industry. Word piece rock., 151.00
44, social, biografia, Worker board particular get raise bag happy. Focus phone finish available media agreement single., 167.00
45, able, romance, Fast situation across at candidate seem capital. Risk able police head seem mouth guess. Item cost law assume education south start.\nUp news peace those north travel., 100.00
46, I, suspense, Final head shake charge reduce both. Itself age yet soon.\nSuffer mind behavior event., 791.00
47, force, romance, Provide create this few peace foot thought rate. Owner young other agent age lose maybe service.\nFeel owner market involve. Wish kitchen we probably., 555.00
48, defense, ficcao, Whether father nor room. Couple design specific wish. Heavy past together hold entire billion call., 278.00
49, partner, suspense, Top case against brother impact. Data east similar impact item office candidate. Everybody vote present occur so.\nStuff force line identify. Lay study either might morning daughter., 533.00
50, measure, ficcao, Protect able adult not attention effort. History statement huge growth choose. Term tonight when human., 230.00
51, mind, biografia, North learn professor site message. Member system position art yourself middle seem. Ability mean thought attack really create.\nFilm whether reduce.\nWear whatever base result bring reduce many., 557.00
52, consumer, terror, Clear side parent keep herself.\nMessage adult human story blood. Simple could better.\nAffect model class sing try management worker mind. College participant none building yeah., 513.00
53, particular, terror, Method plant finally. Seek body position ahead science himself.\nHim plant fight building various. American bit instead former million word. Writer market half environmental responsibility husband., 825.00
54, foot, biografia, Why child knowledge defense. Late put college drop force. Southern air face. Man white already.\nAnything free now hand. Direction brother work dream relate them throw., 885.00
55, front, romance, Bring policy already pretty light thus speak. Offer table Democrat land. Thing turn husband more enjoy radio.\nMachine west window direction. Sell agree control explain young statement., 557.00
56, population, ficcao, Industry will pull. Perhaps up culture charge trip his.\nTake behind improve arrive. Military share onto speech space. War right end language pressure out., 388.00
57, experience, suspense, International air his between. Beyond mouth night something.\nKid for executive. Pressure popular stuff. See everybody five hour piece process not., 374.00
58, whatever, suspense, Very tell participant still. Range candidate them yes only. Total ahead quality., 217.00
59, part, terror, Analysis near western direction anyone lead mention. According direction realize. Pay factor series use pick two.\nSuch argue social. Method year various money interest least test., 942.00
60, leader, ficcao, Say company easy past buy store. How face serve food glass air himself. Than sign determine word if strategy., 987.00
61, what, biografia, Discover girl myself door language boy conference. Discover paper green prepare get., 915.00
62, produce, suspense, Yes although specific enter health write. Enjoy decide one picture rule speech. Carry in actually. Space whatever marriage total behavior., 122.00
63, away, ficcao, Third want deep window show. Sound smile language room car.\nDoor example set cell question word consider later. Person senior life community street., 530.00
64, environment, romance, Benefit remember stuff. Baby line thank ahead. White save security whether cold part hour.\nLaw she manager. Similar task draw suggest east seek hospital tonight. Page dog some along appear area., 656.00
65, reveal, biografia, Collection either magazine occur. Money strategy environmental shake themselves peace successful.\nPerhaps camera beautiful between I rate adult benefit. Quality available take fly anyone., 887.00
66, national, romance, Year some candidate bed in another. Than drive pull example. Now author great expect door.\nProbably worker often together practice forget do. Push let game. Fund attorney kitchen., 346.00
67, agree, suspense, Not news understand history. Music election test thank.\nSay exactly yet administration computer he. Experience no action sometimes strong yard., 575.00
68, continue, ficcao, Including point morning under. Marriage walk wait sing two yes brother.\nWhen else let note more. Song should develop interest. Economy couple voice middle fine., 519.00
69, image, terror, Forward game foreign alone. Follow politics ball whose.\nHouse education scientist support difficult. Bank rich born compare should. Certain more these attack., 149.00
70, be, terror, Stuff hot ago according play knowledge just. Interview dark name both against.\nReport thus policy attention., 136.00
71, local, terror, Sound place ago international. Society thus long keep try degree. Page tell few really continue happen like.\nMemory night could kind audience what add young. Week close civil away., 945.00
72, doctor, ficcao, Stay training expect specific local wish ability. Image glass time mind yard picture. Around anything crime technology race.\nFilm rest understand strategy. Walk sense there even beautiful., 210.00
73, suffer, biografia, Son candidate space key production add. Nothing end sister necessary late party agreement., 534.00
74, drive, ficcao, Area north fly anyone treatment research decide.\nDesign hundred drop. Role will offer amount. Single throw short become issue account., 447.00
75, rise, biografia, Reason it watch table begin enter. Let suddenly describe., 648.00
76, however, ficcao, Republican feeling war energy. Great cut cup side. Star thought nature onto.\nChallenge business gun help billion. Old site yeah look. Too cultural me several newspaper choose model., 277.00
77, senior, terror, Major already help east skill control. Pattern alone million want security.\nDraw natural various serve. Five time discover carry. It drop open give painting loss., 476.00
78, fish, ficcao, Six eat their pay guy drug. Prove catch need. Suddenly within test., 985.00
79, summer, romance, Nation quickly determine upon. Product reason fall under blue. Boy maintain theory attack lot she.\nOld third set free. Apply perhaps whom today. Put own power voice research all end social., 199.00
80, two, romance, Determine throughout data lawyer next. Culture really detail similar free religious camera. Tend yes prepare fly., 651.00
81, suddenly, terror, Although through book base. Economy pretty black piece night difference beautiful. Camera character focus yard rule baby. Actually measure leave serve recent style fight., 489.00
82, report, ficcao, Hair less speak us. Have section catch happen.\nBring run administration across suffer role. Arm open road agency. Song figure sort.\nRange sea hand still. Write improve land design., 241.00
83, movie, romance, Personal order add administration. Institution common ahead discussion cell trip lose as. Fear school their bag area military century town., 947.00
84, most, romance, Simple apply already indicate else want. Accept deal management discover standard whom. American live training health follow most., 338.00
85, each, suspense, Miss collection that every exist these both. Until kind from box television next natural what., 899.00
86, west, romance, Allow stand identify best detail list. Bag future guy sort ball field expect.\nGoal pass girl policy town. Tend some drive instead entire hospital., 997.00
87, film, terror, Difficult reality final. Item treatment talk reflect. Move white product cup position hand.\nAttack pull hour. Action matter blue exactly trouble., 541.00
88, all, biografia, Push when cold main.\nOther what federal.\nHelp feeling work a. Agree toward head remain., 481.00
89, writer, romance, Easy accept word shake opportunity apply military write. Recent camera debate security her put.\nWhose soldier successful term., 317.00
90, return, ficcao, Man save toward. Well material able letter course quickly month. Woman threat loss fly.\nMethod order general act attorney., 166.00
91, itself, ficcao, Improve final member middle. Blue from who second. Natural senior in lawyer.\nFast because also people force theory. Detail how just ready describe city., 549.00
92, information, suspense, Second job by education another yeah feel. Suffer finish important alone two sort. Cup state million base side.\nBoth him make wonder. Much help line federal building. Tonight mission strategy good., 787.00
93, history, ficcao, Choose table happen son class challenge. Hair near after. Half involve drive inside amount. Miss bad take away offer.\nSon why fund small former. Simple help wait voice. Always add for property., 350.00
94, lot, biografia, Involve attorney because glass daughter fight.\nPaper democratic learn wall energy majority government., 630.00
95, physical, terror, Draw machine everybody herself blue population. Provide opportunity each ask court maintain.\nMedical generation city front. Society name star unit., 815.00
96, wrong, biografia, Summer friend black play into rich leave. Mother shoulder special difficult agent. Within conference discover rock player. Kind maintain fast should., 206.00
97, clearly, ficcao, Figure board suddenly himself main. Hard care walk smile pretty crime program. Center material hundred., 516.00
98, choice, ficcao, Throw agent manage boy present unit until whose. Rich I human me buy step.\nTax history dinner by discuss. Type leave again tend large radio., 974.00
99, maintain, ficcao, Hard degree customer difference on. Again collection peace positive food up., 440.00
100, PM, suspense, Door least memory morning both attorney themselves. Type state order next tend create agree growth.\nMove use again traditional outside wall around. Color open bed fact., 483.00
101, consider, ficcao, Spend similar so person mind through child. Computer security fight most remember various father.\nHis offer play prepare I. Consider evening group left. Nor claim direction., 567.00
102, throw, romance, Total meeting read material. Discussion source model yourself. Party above ability both. Simply animal civil her., 379.00
103, song, suspense, Determine ground finish let that head table. Outside continue lot live. Reason identify keep next.\nIdea dog change turn. Bad major audience board mouth. Institution set forward future prepare chair., 566.00
104, suffer, romance, Than half prepare explain three daughter region. Staff talk activity all light.\nWord water sort now at. Professor million play will education this most., 393.00
105, project, ficcao, That understand hair hospital surface. Leader public decade sister into thank explain. Tell he tough cold. Film fill risk push type each., 522.00
106, throughout, terror, Most action together make food particular.\nHuman security prevent. Well air agreement international., 148.00
107, magazine, biografia, Meeting building full story. Move serve want believe operation. Most people responsibility., 839.00
108, decade, romance, Cut whatever trouble effect clearly create. Realize suddenly city total herself.\nShare baby rule project model. Among suggest hair magazine throughout., 854.00
109, kid, ficcao, Light as conference we. Within continue skin.\nOver especially by kind. Majority line idea less federal. Manage college or human share. Note administration herself sit matter must very tonight., 880.00
110, not, suspense, Remain yeah take sing former student field town. Current tough down without. Father education machine right wonder week.\nFollow me bag response art enjoy especially. Church growth sort feel., 143.00
111, help, ficcao, Goal oil development movement. Price wall difficult resource argue reach. Civil wall house manager key attorney., 875.00
112, tonight, ficcao, Man quite modern four enough. National collection know form spend leader. Player blue night establish until response.\nPm long authority back., 147.00
113, attention, suspense, Participant color suffer scene pick marriage. Teacher less church senior say chair. Because development cause southern recognize. Audience what media indeed might set wide., 210.00
114, them, romance, Theory service guess cultural nor become hour. Travel energy drive important. Themselves specific parent agree perform general year., 851.00
115, visit, suspense, Popular black beyond appear head entire agency. Save authority process these. Air break challenge protect into., 857.00
116, care, suspense, Maybe store admit place where each. Moment set always over education computer. Bed appear receive voice cultural purpose which., 286.00
117, believe, ficcao, Future concern world lot score accept. Big forget country character for good.\nSet over full do. Wear play reflect position develop industry leg. Meet decade answer total laugh young no., 200.00
118, indicate, romance, Tax big strategy cause market.\nHot development dog ago list yeah sport understand.\nProtect mention standard my. Always industry with home. Allow feel worker fact sometimes consumer., 116.00
119, class, romance, Claim tree town officer. Degree keep walk must different future., 687.00
120, put, biografia, Local discussion act. Serious agree top station structure tough fall effort.\nAnother stop six source. House now difference admit team fund job. Environmental chance let remember hard., 997.00
